<?xml version='1.0' encoding='UTF-8'?>
<!DOCTYPE dataset SYSTEM "../../dbunit-toolkit-export-choice.dtd" >
<dataset>
  <VOCABULARIES
      ID="1"
      OWNER="ands"
      TITLE="testResourceMapTransformProvider3-1"
      SLUG="testresourcemaptransformprovider3-1"
      />
  <VOCABULARIES
      ID="2"
      OWNER="another"
      TITLE="testResourceMapTransformProvider3-2"
      SLUG="testresourcemaptransformprovider3-2"
      />
  <VERSIONS
      ID="1"
      VOCAB_ID="1"
      TITLE="v1" />
  <VERSIONS
      ID="2"
      VOCAB_ID="2"
      TITLE="v1" />
  <RESOURCE_OWNER_HOSTS
      ID="1"
      START_DATE="2016-09-16"
      END_DATE="9999-12-01"
      OWNER="ands"
      HOST="vocab.owner.org"
      />
  <RESOURCE_OWNER_HOSTS
      ID="2"
      START_DATE="2016-09-16"
      END_DATE="9999-12-01"
      OWNER="ands"
      HOST="second.owned.com"
      />
  <RESOURCE_OWNER_HOSTS
      ID="3"
      START_DATE="2016-09-16"
      END_DATE="9999-12-01"
      OWNER="ands"
      HOST="third.another.edu"
      />
  <RESOURCE_OWNER_HOSTS
      ID="4"
      START_DATE="2016-09-16"
      END_DATE="9999-12-01"
      OWNER="another"
      HOST="third.another.edu"
      />
  <TASK
      ID="1"
      VOCABULARY_ID="1"
      VERSION_ID="1"
      PARAMS="[
                {
                  ''type'': ''HARVEST'',
                  ''provider_type'': ''File'',
                  ''file_path'': ''src/test/resources/input/au.org.ands.vocabs.toolkit.test.arquillian.AllArquillianTests.testResourceMapTransformProvider3/test-data1.ttl''
                },
                {
                  ''type'': ''IMPORT'',
                  ''provider_type'': ''Sesame''
                },
                {
                  ''type'': ''PUBLISH'',
                  ''provider_type'': ''SISSVoc''
                },
                {
                  ''type'': ''TRANSFORM'',
                  ''provider_type'': ''ResourceMap''
                }
              ]"
      />
  <TASK
      ID="2"
      VOCABULARY_ID="2"
      VERSION_ID="2"
      PARAMS="[
                {
                  ''type'': ''HARVEST'',
                  ''provider_type'': ''File'',
                  ''file_path'': ''src/test/resources/input/au.org.ands.vocabs.toolkit.test.arquillian.AllArquillianTests.testResourceMapTransformProvider3/test-data2.ttl''
                },
                {
                  ''type'': ''IMPORT'',
                  ''provider_type'': ''Sesame''
                },
                {
                  ''type'': ''PUBLISH'',
                  ''provider_type'': ''SISSVoc''
                },
                {
                  ''type'': ''TRANSFORM'',
                  ''provider_type'': ''ResourceMap''
                }
              ]"
      />
</dataset>
